{
  "registry": "vortik-semantic-registry",
  "version": "0.6.5",
  "description": "Independent semantic registry indexing Ethereum protocol primitives, roles, constraints, and selected external coordination surfaces via ENS-anchored schemas.",
  "source_of_truth": "schemas",
  "last_updated": "2026-09-13",
  "anchors": [
    {
      "id": "epbs",
      "ens": "epbs.eth",
      "canonical_term": "enshrined proposer-builder separation (ePBS)",
      "classification": "core",
      "status": "implementation-facing",
      "status_label": "core",
      "stage": "canonical",
      "market_priority": "high",
      "type": "primitive",
      "role": "protocol-defined proposer-builder separation with active implementation-facing relevance, commitment-based block production, signed bid flow, payload reveal semantics, and growing consensus-specs convergence",
      "schema": "schemas/epbs/1.0-draft/schema.json",
      "anchor_doc": "anchors/epbs.md",
      "market": {
        "priority": "high",
        "visibility": "featured"
      }
    },
    {
      "id": "inclusionlist",
      "ens": "inclusionlist.eth",
      "canonical_term": "fork-choice enforced inclusion lists (FOCIL)",
      "classification": "core",
      "status": "eip-active",
      "status_label": "core",
      "stage": "canonical",
      "market_priority": "high",
      "type": "constraint",
      "role": "protocol-enforced inclusion constraint with fork-scoped relevance, validator committee enforcement, and direct alignment with FOCIL-style inclusion guarantees",
      "schema": "schemas/inclusionlist/0.1-draft/schema.json",
      "anchor_doc": "anchors/inclusionlist.md",
      "market": {
        "priority": "high",
        "visibility": "featured"
      }
    },
    {
      "id": "commitmentlayer",
      "ens": "commitmentlayer.eth",
      "canonical_term": "commitment",
      "classification": "repairable",
      "status": "research",
      "status_label": "emerging",
      "stage": "emerging",
      "market_priority": "medium",
      "type": "primitive",
      "role": "protocol-relevant commitment primitive used for pre-reveal coordination, bid-based block production, proposer-builder interaction, encrypted flow, and delayed verification patterns, with naming mismatch in ENS suffix",
      "schema": "schemas/commitmentlayer/0.1-draft/schema.json",
      "anchor_doc": "anchors/commitmentlayer.md",
      "market": {
        "priority": "medium",
        "visibility": "standard"
      }
    },
    {
      "id": "preconflayer",
      "ens": "preconflayer.eth",
      "canonical_term": "preconfirmation (emergent)",
      "classification": "premature",
      "status": "research",
      "status_label": "emerging",
      "stage": "research",
      "market_priority": "medium",
      "type": "external_mechanism",
      "role": "emergent off-protocol guarantee mechanism concerning likely inclusion, ordering, or execution outcome before final protocol confirmation, with naming mismatch in ENS suffix",
      "schema": "schemas/preconflayer/0.1-draft/schema.json",
      "anchor_doc": "anchors/preconflayer.md",
      "market": {
        "priority": "medium",
        "visibility": "standard"
      }
    },
    {
      "id": "ssf",
      "ens": "fastfinality.eth",
      "canonical_term": "single-slot finality (SSF)",
      "classification": "repairable",
      "status": "research",
      "status_label": "emerging",
      "stage": "research",
      "market_priority": "medium",
      "type": "primitive",
      "role": "finality research primitive tracking SSF as a specific same-slot target within the broader Fast Finality research area, with an ENS-to-canonical scope mismatch rather than invalid or displaced terminology",
      "schema": "schemas/ssf/0.1-research/schema.json",
      "anchor_doc": "anchors/fastfinality.md",
      "market": {
        "priority": "medium",
        "visibility": "standard"
      }
    },
    {
      "id": "buildermarket",
      "ens": "buildermarket.eth",
      "canonical_term": "builder",
      "classification": "deprecated",
      "status": "research",
      "status_label": "deprecated",
      "stage": "research",
      "market_priority": "low",
      "type": "misaligned_abstraction",
      "role": "legacy market framing displaced by the protocol-native builder role under ePBS and more precise proposer-builder coordination terminology",
      "schema": "schemas/buildermarket/0.1-research/schema.json",
      "anchor_doc": "anchors/buildermarket.md",
      "market": {
        "priority": "low",
        "visibility": "background"
      }
    },
    {
      "id": "solverlayer",
      "ens": "solverlayer.eth",
      "canonical_term": "solver (external)",
      "classification": "external",
      "status": "research",
      "status_label": "external",
      "stage": "research",
      "market_priority": "low",
      "type": "external_actor",
      "role": "off-protocol actor coordinating intent resolution, execution strategy formation, routing, and settlement pathways before protocol-level block construction",
      "schema": "schemas/solverlayer/0.1-research/schema.json",
      "anchor_doc": "anchors/solverlayer.md",
      "market": {
        "priority": "low",
        "visibility": "background"
      }
    },
    {
      "id": "executionmarket",
      "ens": "executionmarket.eth",
      "canonical_term": "execution (ambiguous)",
      "classification": "deprecated",
      "status": "research",
      "status_label": "deprecated",
      "stage": "research",
      "market_priority": "low",
      "type": "misaligned_abstraction",
      "role": "non-canonical market framing that does not map cleanly to any single protocol primitive, role, constraint, or execution object, and is increasingly pressured by narrower terms such as payload, commitment, builder, inclusion list, and block access list",
      "schema": "schemas/executionmarket/0.1-research/schema.json",
      "anchor_doc": "anchors/executionmarket.md",
      "market": {
        "priority": "low",
        "visibility": "background"
      }
    },
    {
      "id": "orderflowauction",
      "ens": "orderflowauction.eth",
      "canonical_term": "order flow auctions (OFA)",
      "classification": "external",
      "status": "research",
      "status_label": "external",
      "stage": "implemented",
      "market_priority": "medium",
      "type": "coordination_surface",
      "role": "external order-flow routing and auction surface operating before protocol-level builder coordination, with relevance under pressure from encrypted flow, sealed transactions, and commit-before-reveal mechanisms",
      "schema": "schemas/orderflowauction/0.1-research/schema.json",
      "anchor_doc": "anchors/orderflowauction.md",
      "market": {
        "priority": "medium",
        "visibility": "standard"
      }
    },
    {
      "id": "provingmarket",
      "ens": "provingmarket.eth",
      "canonical_term": "proving markets",
      "classification": "external",
      "status": "research",
      "status_label": "external",
      "stage": "research",
      "market_priority": "medium",
      "type": "coordination_surface",
      "role": "external proof generation and proving coordination surface across zk systems, validity proofs, rollups, proof aggregation, and distributed proving infrastructure",
      "schema": "schemas/provingmarket/0.1-research/schema.json",
      "anchor_doc": "anchors/provingmarket.md",
      "market": {
        "priority": "medium",
        "visibility": "standard"
      }
    },
    {
      "id": "sequencingmarket",
      "ens": "sequencingmarket.eth",
      "canonical_term": "sequencing markets",
      "classification": "external",
      "status": "research",
      "status_label": "external",
      "stage": "research",
      "market_priority": "medium",
      "type": "coordination_surface",
      "role": "external transaction ordering and sequencing coordination surface across rollups, shared sequencing systems, ordering rights, cross-domain execution, and settlement-adjacent infrastructure",
      "schema": "schemas/sequencingmarket/0.1-research/schema.json",
      "anchor_doc": "anchors/sequencingmarket.md",
      "market": {
        "priority": "medium",
        "visibility": "standard"
      }
    },
    {
      "id": "blockspacemarket",
      "ens": "blockspacemarket.eth",
      "canonical_term": "blockspace markets",
      "classification": "deprecated",
      "status": "research",
      "status_label": "deprecated",
      "stage": "research",
      "market_priority": "low",
      "type": "misaligned_abstraction",
      "role": "legacy pre-ePBS market framing increasingly displaced by protocol-native roles, commitments, payloads, inclusion constraints, and narrower execution-resource terminology",
      "schema": "schemas/blockspacemarket/0.1-research/schema.json",
      "anchor_doc": "anchors/blockspacemarket.md",
      "market": {
        "priority": "low",
        "visibility": "background"
      }
    }
  ]
}
